objectid:,filename:,title:,format:,youtubeid:,vimeoid:,latitude:,longitude:,location: ,isbn-10:,isbn-13:,subject:,language:,page count:,creator:
coll001,anatomy.jpg,The Anatomy Coloring Book - 4th Edition,image/jpeg,,,,,,321832019,978-0321832016,Anatomy,en,384,Pearson
coll002,biology.jpg,"Biology Coloring Workbook, 2nd Edition: An Easier and Better Way to Learn Biology",image/jpeg,,,,,,451487788,978-0451487780,Biology,en,384,Princeton Review
coll003,zen.jpg,"Zensational Adult Coloring Book: Zen inspired philosophical and motivational, images and designs that help relieve stress and anxiety",image/jpeg,,,,,,,979-8398467062,Meditation ,en,100,Ted E Care Publishing
coll004,plant.jpg,The Plant Parent Coloring Book: Beautiful Houseplant Love and Care,image/jpeg,,,,,,1951728181,978-1951728182,Horticulture ,en,65,"Eclectic Esquire Media, LLC"
coll005,stress.jpg,Stress Relief Coloring Book for Adults,image/jpeg,,,,,,1648766099,‎978-1648766091,Meditation ,en,72,Rockridge Press
coll006,tagalong.jpg,Tagalog Picture Dictionary Coloring Book: Over 1500 Tagalog Words and Phrases for Creative & Visual Learners of All Ages (Color and Learn),image/jpeg,,,,,,1951949676,978-1951949679,Language,en,190,Lingo Mastery
coll007,multiplication.jpg,"Color by math, multiplication and division for kids ages 8-12",image/jpeg,,,,,,,979-8843969578,Math ,en,72,Three Sparrows
coll008,life.jpg,Life under the lens: A Scientific Colouring Book,image/jpeg,,,,,,1999742206,978-1999742201,Biology ,en,106,Jenifer Delany
coll009,picture9.jpg,Color By Math! Activity Coloring Book for Kids,image/jpeg,,,,,,1541909607,978-1541909601,Math ,en,106,Speedy Kids
coll010,icandothis.jpg,I Can Do This!: Coloring Book of Inspirational Quotes & Mindfulness Mandala Animal Artwork for Teens and Adults,image/jpeg,,,,,,,979-8988493167,Meditation ,en,102,"Happy Hobble Books, LLC"